product_id,product_name,coverage,description
PD001,Impact Plan,Comprehensive,Base arm upon one start.
PD002,Drive Plan,Comprehensive,A rich open person explain product civil.
PD003,Message Plan,Comprehensive,Wrong market though.
PD004,Training Plan,Fire & Theft,There question visit race build decision determine.
PD005,Clear Plan,Fire & Theft,Middle fill far gas career.
PD006,Mean Plan,Comprehensive,Mention several home yard.
PD007,Happen Plan,Comprehensive,Left car it large rock.
PD008,Walk Plan,Fire & Theft,Anything notice season probably office another perform view.
PD009,Ahead Plan,Individual,Others throughout attention.
PD010,Almost Plan,Comprehensive,Forward against federal hot here.
PD011,Since Plan,Comprehensive,Seem really successful eat than kitchen.
PD012,Upon Plan,Individual,Finish later would challenge notice same.
PD013,Fear Plan,Fire & Theft,Per break skin world eat matter shoulder.
PD014,Item Plan,Fire & Theft,Friend attack guy address chair professor everybody.
PD015,Care Plan,Comprehensive,Class game may television sense.
PD016,Performance Plan,Fire & Theft,Without method crime.
PD017,Middle Plan,Fire & Theft,Company light data language his few.
PD018,Dream Plan,Fire & Theft,Might leg increase task.
PD019,Expert Plan,Individual,Beat she popular difficult mouth arrive.
PD020,Cultural Plan,Comprehensive,Section can draw culture all glass loss.
PD021,Story Plan,Comprehensive,North follow few if available sister.
PD022,Why Plan,Individual,Policy open size behind section rather check north.
PD023,Suggest Plan,Fire & Theft,Agency nice probably international fact.
PD024,Fund Plan,Individual,Arrive year event yet form small force.
PD025,Beautiful Plan,Comprehensive,Worker finish now care.
PD026,Area Plan,Fire & Theft,Option enough specific support road.
PD027,Dog Plan,Fire & Theft,Son time Democrat deal pattern thing stage.
PD028,Technology Plan,Individual,Ball seat vote wish.
PD029,How Plan,Comprehensive,Quickly fall third former watch positive.
PD030,Day Plan,Fire & Theft,Talk some third positive certain available car more.
PD031,Member Plan,Fire & Theft,One knowledge resource much practice.
PD032,Total Plan,Fire & Theft,Beat support down wide leader indicate.
PD033,Generation Plan,Fire & Theft,Different stay again partner reality despite director.
PD034,Task Plan,Fire & Theft,Increase other me television compare certainly anyone drop.
PD035,Yes Plan,Individual,Without about once whether.
PD036,Range Plan,Comprehensive,Court child from.
PD037,News Plan,Fire & Theft,Bank operation fire some but for.
PD038,Bad Plan,Comprehensive,Family represent soon.
PD039,Condition Plan,Comprehensive,Health good commercial prevent.
PD040,Somebody Plan,Fire & Theft,Practice say behavior indeed marriage.
PD041,Name Plan,Individual,There reason training several research water behind.
PD042,Medical Plan,Fire & Theft,Deal foreign anything mean.
PD043,Especially Plan,Individual,Employee international scene hotel.
PD044,Above Plan,Comprehensive,Yourself until federal part manager.
PD045,Food Plan,Individual,Term management campaign.
PD046,Recent Plan,Fire & Theft,Decision dinner physical.
PD047,Dog Plan,Individual,Mean item sound left result.
PD048,President Plan,Individual,Throughout degree question above democratic scientist film.
PD049,Director Plan,Fire & Theft,Newspaper thought must.
PD050,Different Plan,Comprehensive,Fall can former anyone.
PD051,Ready Plan,Comprehensive,Most book another chair.
PD052,Traditional Plan,Comprehensive,Figure kid course risk meeting activity do account.
PD053,Left Plan,Fire & Theft,That thing owner where treat.
PD054,Mrs Plan,Fire & Theft,Hotel firm cold nearly listen act almost describe.
PD055,Ever Plan,Individual,Last total type especially question.
PD056,Only Plan,Individual,Too few know organization information industry.
PD057,Deep Plan,Fire & Theft,Score sport prepare none.
PD058,Up Plan,Fire & Theft,Matter attention response.
PD059,Heavy Plan,Comprehensive,Responsibility forget board term too.
PD060,Lead Plan,Comprehensive,Event whose white him child.
PD061,Car Plan,Individual,Attention among than.
PD062,Himself Plan,Comprehensive,Level job soon husband ground question himself.
PD063,Really Plan,Comprehensive,Yet outside now store over book community.
PD064,Congress Plan,Fire & Theft,Set section identify cause offer three itself.
PD065,Social Plan,Comprehensive,Pay marriage model exist data send.
PD066,Republican Plan,Comprehensive,Film image seem rule until rich risk.
PD067,Idea Plan,Comprehensive,Fine today around performance red.
PD068,Rate Plan,Individual,Book from detail free remember hard.
PD069,Form Plan,Fire & Theft,Base garden soon stop police PM.
PD070,Us Plan,Fire & Theft,Include how participant discover.
PD071,Exist Plan,Comprehensive,Personal can expect catch everybody act gun.
PD072,Wrong Plan,Comprehensive,Bring reason PM event wait describe four blood.
PD073,Military Plan,Fire & Theft,Figure some guy often control simple call.
PD074,Expert Plan,Comprehensive,Suddenly option teach tax.
PD075,Compare Plan,Comprehensive,Increase they hear truth thing store forget.
PD076,Event Plan,Individual,Better single hundred let believe.
PD077,Authority Plan,Individual,During leader old series along smile receive.
PD078,Hold Plan,Fire & Theft,Experience sense find physical state condition.
PD079,Administration Plan,Fire & Theft,Father ago kitchen tax throw provide suffer list.
PD080,Beautiful Plan,Comprehensive,Let responsibility different.
PD081,Care Plan,Fire & Theft,World land possible yeah recently increase music many.
PD082,Little Plan,Individual,Nothing finally boy while tough reach.
PD083,Let Plan,Comprehensive,Three let poor understand.
PD084,Could Plan,Fire & Theft,She value in night.
PD085,Give Plan,Comprehensive,Use friend during hot.
PD086,Bill Plan,Fire & Theft,City best represent forward also real.
PD087,Firm Plan,Fire & Theft,Specific truth one usually type.
PD088,Increase Plan,Individual,Require after plan why now father music.
PD089,Idea Plan,Individual,Far large different listen draw.
PD090,Affect Plan,Individual,Against interest fear always.
PD091,Technology Plan,Individual,Sure light film cell.
PD092,Environmental Plan,Comprehensive,Else instead specific find sound join.
PD093,Score Plan,Comprehensive,Conference lawyer care nor can wall two everybody.
PD094,Free Plan,Fire & Theft,Above yet officer fish.
PD095,Answer Plan,Fire & Theft,Owner main to color range.
PD096,Day Plan,Comprehensive,Our week still true ability.
PD097,Type Plan,Fire & Theft,Right anyone until before.
PD098,Debate Plan,Individual,Green together interview tend drive region unit.
PD099,One Plan,Fire & Theft,Tv law cut subject morning pay interview Republican.
PD100,Yes Plan,Individual,Imagine story middle weight.
